{
  "schemaVersion": "planprice-catalog/1",
  "catalogVersion": "cat_example_001",
  "generatedAt": "2026-09-23T00:00:00Z",
  "effectiveAt": "2026-09-23T00:00:00Z",
  "expiresAt": "2026-09-23T00:05:00Z",
  "baseCurrency": "USD",
  "offerings": [
    {
      "offeringId": "off_example_001",
      "modelId": "mdl_example",
      "modelVersion": "2026-05",
      "versionStatus": "pinned",
      "providerId": "prv_example",
      "channelId": "chn_standard",
      "regionSetId": "rgn_cn",
      "pricingVariantId": "price_example_001",
      "regions": [
        "cn"
      ],
      "capabilities": [
        "agent",
        "text"
      ],
      "contextWindow": 128000,
      "catalogStatus": "available",
      "runtimeStatus": "unknown",
      "runtimeObservedAt": null,
      "runtimeEvidenceRef": null,
      "pricing": {
        "currency": "CNY",
        "effectiveAt": "2026-09-23T00:00:00Z",
        "expiresAt": "2026-09-30T00:00:00Z",
        "components": [
          {
            "componentId": "input",
            "kind": "input",
            "unit": "token",
            "currency": "CNY",
            "priceStatus": "known",
            "pricePerMillion": "1",
            "conditions": {
              "schemaVersion": "pricing-conditions/1",
              "kind": "standard"
            }
          },
          {
            "componentId": "output",
            "kind": "output",
            "unit": "token",
            "currency": "CNY",
            "priceStatus": "known",
            "pricePerMillion": "2",
            "conditions": {
              "schemaVersion": "pricing-conditions/1",
              "kind": "standard"
            }
          }
        ],
        "provenance": {
          "sourceId": "source_example",
          "sourceUrl": "https://provider.example/pricing",
          "observedAt": "2026-09-23T00:00:00Z",
          "evidenceDigest": "sha256:0000000000000000000000000000000000000000000000000000000000000000"
        },
        "normalization": {
          "status": "available",
          "currency": "USD",
          "componentPrices": {
            "input": "0.13888889",
            "output": "0.27777778"
          },
          "fx": {
            "base": "USD",
            "quote": "CNY",
            "rate": "7.2",
            "direction": "quote_per_base",
            "asOf": "2026-09-23T00:00:00Z",
            "expiresAt": "2026-09-24T00:00:00Z",
            "sourceId": "fx_source_example",
            "evidenceDigest": "sha256:0000000000000000000000000000000000000000000000000000000000000000"
          },
          "rounding": {
            "scale": 8,
            "mode": "half_even",
            "stage": "converted_unit_price"
          }
        }
      }
    }
  ],
  "digest": "sha256:4b078e25320aa02a9aefed840c38ca60ce9ed1200a8ffdea32cdb45d76c11fa8"
}
